{
  "id": "2086338808770187358",
  "title": "A young Japanese woman wearing an elegant feminine summer dress with a soft…",
  "content": "A young Japanese woman wearing an elegant feminine summer dress with a soft floral pattern and flowing fabric. She walks casually through a charming Japanese city street on a pleasant afternoon, holding a cold drink.\n\n0–5 sec: She walks naturally while looking around, her hair and dress gently moving in the breeze. Her female friend films her handheld from the side.\n\n5–10 sec: She stops near a small café, takes a sip of her drink, checks her phone, then looks around with a soft, cute smile.\n\n10–15 sec: She notices the camera, gives a sweet little smile, slightly raises her drink and says naturally in Japanese: 「今日は自分の時間。」 Then she turns back and continues walking.\n\nMaintain the same face, hairstyle, outfit, body proportions, and identity throughout the video.",
  "language": "en",
  "thumbnail": "https://pbs.twimg.com/amplify_video_thumb/2086338307068465152/img/4QPsMxBFh2pKbl3O.jpg",
  "videoUrl": "https://talented-lioness-5423.edgespark.app/api/public/media/seedance/videos/2086338808770187358.mp4",
  "sourceLink": "https://x.com/MissDelulu9/status/2086338808770187358",
  "sourcePublishedAt": "2026-08-09",
  "author": {
    "name": "Eesha",
    "link": "https://x.com/MissDelulu9"
  },
  "tags": [
    "Portrait & Fashion",
    "Travel Vlog",
    "Photoreal",
    "Realistic World"
  ],
  "translations": {
    "es": {
      "content": "Una joven japonesa que lleva un elegante vestido veraniego femenino con un suave estampado floral y una tela fluida. Camina con naturalidad por una encantadora calle de una ciudad japonesa en una agradable tarde, sosteniendo una bebida fría.\n\n0–5 sec: Camina de forma natural mientras mira a su alrededor, con el cabello y el vestido moviéndose suavemente con la brisa. Su amiga la graba con la cámara en mano desde un lado.\n\n5–10 sec: Se detiene cerca de un pequeño café, da un sorbo a su bebida, revisa su teléfono y luego mira alrededor con una sonrisa suave y adorable.\n\n10–15 sec: Nota la cámara, esboza una dulce sonrisa, levanta ligeramente su bebida y dice con naturalidad en japonés: 「今日は自分の時間。」 Luego se da la vuelta y continúa caminando.\n\nMantén la misma cara, peinado, atuendo, proporciones corporales e identidad durante todo el video.\n\n--- CONTINUACIÓN DEL HILO ---\n[Thread 1] Una joven japonesa que lleva un elegante vestido veraniego femenino con un suave estampado floral y una tela fluida. Camina con naturalidad por una encantadora calle de una ciudad japonesa en una agradable tarde, sosteniendo una bebida fría.\n\n0–5 sec: Camina de forma natural mientras mira a su alrededor, con el cabello y el vestido moviéndose suavemente con la brisa. Su amiga la graba con la cámara en mano desde un lado.\n\n5–10 sec: Se detiene cerca de un pequeño café, da un sorbo a su bebida, revisa su teléfono y luego mira alrededor con una sonrisa suave y adorable.\n\n10–15 sec: Nota la cámara, esboza una dulce sonrisa, levanta ligeramente su bebida y dice con naturalidad en japonés: 「今日は自分の時間。」 Luego se da la vuelta y continúa caminando.\n\nMantén la misma cara, peinado, atuendo, proporciones corporales e identidad durante todo el video."
    },
    "fr": {
      "content": "Une jeune femme japonaise portant une élégante robe d’été féminine à motif floral délicat et au tissu fluide. Elle se promène tranquillement dans une charmante rue d’une ville japonaise, par un après-midi agréable, en tenant une boisson fraîche.\n\n0–5 sec : Elle marche naturellement en regardant autour d’elle, tandis que ses cheveux et sa robe bougent doucement dans la brise. Son amie la filme à la main de côté.\n\n5–10 sec : Elle s’arrête près d’un petit café, prend une gorgée de sa boisson, consulte son téléphone, puis regarde autour d’elle avec un doux sourire mignon.\n\n10–15 sec : Elle remarque la caméra, esquisse un petit sourire adorable, lève légèrement sa boisson et dit naturellement en japonais : 「今日は自分の時間。」 Puis elle se retourne et continue de marcher.\n\nConservez le même visage, la même coiffure, la même tenue, les mêmes proportions corporelles et la même identité tout au long de la vidéo.\n\n--- CONTINUATION DU FIL ---\n[Fil 1] Une jeune femme japonaise portant une élégante robe d’été féminine à motif floral délicat et au tissu fluide. Elle se promène tranquillement dans une charmante rue d’une ville japonaise, par un après-midi agréable, en tenant une boisson fraîche.\n\n0–5 sec : Elle marche naturellement en regardant autour d’elle, tandis que ses cheveux et sa robe bougent doucement dans la brise. Son amie la filme à la main de côté.\n\n5–10 sec : Elle s’arrête près d’un petit café, prend une gorgée de sa boisson, consulte son téléphone, puis regarde autour d’elle avec un doux sourire mignon.\n\n10–15 sec : Elle remarque la caméra, esquisse un petit sourire adorable, lève légèrement sa boisson et dit naturellement en japonais : 「今日は自分の時間。」 Puis elle se retourne et continue de marcher.\n\nConservez le même visage, la même coiffure, la même tenue, les mêmes proportions corporelles et la même identité tout au long de la vidéo."
    },
    "ja": {
      "content": "エレガントで女性らしい夏のワンピースを着た若い日本人女性。やわらかな花柄と、風になびく軽やかな生地が特徴です。彼女は冷たい飲み物を手に持ちながら、心地よい午後の日本の街並みを、気軽に歩いています。\n\n0〜5秒: 彼女は自然に歩きながら周囲を見回し、髪とワンピースがそよ風にやさしく揺れます。女性の友人が横から手持ちで撮影しています。\n\n5〜10秒: 彼女は小さなカフェの近くで立ち止まり、飲み物をひと口飲んでスマホを確認し、そのあと、やわらかく可愛らしい笑顔であたりを見回します。\n\n10〜15秒: 彼女はカメラに気づき、愛らしい小さな笑みを浮かべ、飲み物を少し持ち上げて、日本語で自然にこう言います: 「今日は自分の時間。」 その後、振り返って歩き続けます。\n\n動画全体を通して、同じ顔、髪型、服装、体型、そして同一人物であることを維持してください。\n\n--- THREAD CONTINUATION ---\n[Thread 1] エレガントで女性らしい夏のワンピースを着た若い日本人女性。やわらかな花柄と、風になびく軽やかな生地が特徴です。彼女は冷たい飲み物を手に持ちながら、心地よい午後の日本の街並みを、気軽に歩いています。\n\n0〜5秒: 彼女は自然に歩きながら周囲を見回し、髪とワンピースがそよ風にやさしく揺れます。女性の友人が横から手持ちで撮影しています。\n\n5〜10秒: 彼女は小さなカフェの近くで立ち止まり、飲み物をひと口飲んでスマホを確認し、そのあと、やわらかく可愛らしい笑顔であたりを見回します。\n\n10〜15秒: 彼女はカメラに気づき、愛らしい小さな笑みを浮かべ、飲み物を少し持ち上げて、日本語で自然にこう言います: 「今日は自分の時間。」 その後、振り返って歩き続けます。\n\n動画全体を通して、同じ顔、髪型、服装、体型、そして同一人物であることを維持してください。"
    },
    "ko": {
      "content": "우아하고 여성스러운 여름 원피스를 입은 젊은 일본인 여성으로, 부드러운 플로럴 패턴과 자연스럽게 흐르는 원단이 특징이다. 그녀는 시원한 음료를 들고, 기분 좋은 오후의 매력적인 일본 도시 거리에서 자연스럽게 걷는다.\n\n0–5초: 그녀는 주변을 둘러보며 자연스럽게 걷고, 바람에 머리카락과 드레스가 부드럽게 흔들린다. 여성 친구가 옆에서 핸드헬드로 그녀를 촬영한다.\n\n5–10초: 그녀는 작은 카페 근처에서 멈춰 음료를 한 모금 마시고, 휴대폰을 확인한 뒤, 부드럽고 사랑스러운 미소를 지으며 주변을 둘러본다.\n\n10–15초: 그녀는 카메라를 알아차리고, 사랑스러운 작은 미소를 지은 뒤 음료를 살짝 들어 올리며 일본어로 자연스럽게 말한다: 「今日は自分の時間。」 그런 다음 다시 돌아서 계속 걸어간다.\n\n영상 내내 같은 얼굴, 헤어스타일, 의상, 신체 비율, 그리고 정체성을 유지한다.\n\n--- THREAD CONTINUATION ---\n[Thread 1] 우아하고 여성스러운 여름 원피스를 입은 젊은 일본인 여성으로, 부드러운 플로럴 패턴과 자연스럽게 흐르는 원단이 특징이다. 그녀는 시원한 음료를 들고, 기분 좋은 오후의 매력적인 일본 도시 거리에서 자연스럽게 걷는다.\n\n0–5초: 그녀는 주변을 둘러보며 자연스럽게 걷고, 바람에 머리카락과 드레스가 부드럽게 흔들린다. 여성 친구가 옆에서 핸드헬드로 그녀를 촬영한다.\n\n5–10초: 그녀는 작은 카페 근처에서 멈춰 음료를 한 모금 마시고, 휴대폰을 확인한 뒤, 부드럽고 사랑스러운 미소를 지으며 주변을 둘러본다.\n\n10–15초: 그녀는 카메라를 알아차리고, 사랑스러운 작은 미소를 지은 뒤 음료를 살짝 들어 올리며 일본어로 자연스럽게 말한다: 「今日は自分の時間。」 그런 다음 다시 돌아서 계속 걸어간다.\n\n영상 내내 같은 얼굴, 헤어스타일, 의상, 신체 비율, 그리고 정체성을 유지한다."
    },
    "pt": {
      "content": "Uma jovem mulher japonesa usando um elegante vestido de verão feminino com uma delicada estampa floral e tecido fluido. Ela caminha casualmente por uma charmosa rua de uma cidade japonesa em uma tarde agradável, segurando uma bebida gelada.\n\n0–5 sec: Ela caminha naturalmente enquanto olha ao redor, com o cabelo e o vestido se movendo suavemente com a brisa. Sua amiga a filma com a câmera na mão, de lado.\n\n5–10 sec: Ela para perto de um pequeno café, toma um gole da bebida, verifica o celular e então olha ao redor com um sorriso suave e fofo.\n\n10–15 sec: Ela percebe a câmera, dá um sorrisinho doce, ergue levemente a bebida e diz naturalmente em japonês: 「今日は自分の時間。」 Então ela se vira e continua caminhando.\n\nMantenha o mesmo rosto, penteado, roupa, proporções corporais e identidade ao longo de todo o vídeo.\n\n--- CONTINUAÇÃO DO THREAD ---\n[Thread 1] Uma jovem mulher japonesa usando um elegante vestido de verão feminino com uma delicada estampa floral e tecido fluido. Ela caminha casualmente por uma charmosa rua de uma cidade japonesa em uma tarde agradável, segurando uma bebida gelada.\n\n0–5 sec: Ela caminha naturalmente enquanto olha ao redor, com o cabelo e o vestido se movendo suavemente com a brisa. Sua amiga a filma com a câmera na mão, de lado.\n\n5–10 sec: Ela para perto de um pequeno café, toma um gole da bebida, verifica o celular e então olha ao redor com um sorriso suave e fofo.\n\n10–15 sec: Ela percebe a câmera, dá um sorrisinho doce, ergue levemente a bebida e diz naturalmente em japonês: 「今日は自分の時間。」 Então ela se vira e continua caminhando.\n\nMantenha o mesmo rosto, penteado, roupa, proporções corporais e identidade ao longo de todo o vídeo."
    },
    "zh": {
      "content": "一位年轻的日本女性，身穿优雅的女性化夏日连衣裙，带有柔和的花卉图案和飘逸的面料。她在一个宜人的午后，手里拿着一杯冰饮，悠闲地走在一条迷人的日本城市街道上。\n\n0–5秒：她自然地走着，四处张望，头发和裙摆在微风中轻轻摆动。她的女性朋友从侧面用手持方式拍摄她。\n\n5–10秒：她在一家小咖啡馆附近停下，喝了一口饮料，查看手机，然后带着温柔、可爱的微笑环顾四周。\n\n10–15秒：她注意到镜头，露出一个甜美的小笑容，微微举起饮料，并自然地用日语说道：「今日は自分の時間。」然后她转身继续走路。\n\n在整个视频中保持相同的面容、发型、服装、身体比例和身份。\n\n--- 线程续写 ---\n[Thread 1] 一位年轻的日本女性，身穿优雅的女性化夏日连衣裙，带有柔和的花卉图案和飘逸的面料。她在一个宜人的午后，手里拿着一杯冰饮，悠闲地走在一条迷人的日本城市街道上。\n\n0–5秒：她自然地走着，四处张望，头发和裙摆在微风中轻轻摆动。她的女性朋友从侧面用手持方式拍摄她。\n\n5–10秒：她在一家小咖啡馆附近停下，喝了一口饮料，查看手机，然后带着温柔、可爱的微笑环顾四周。\n\n10–15秒：她注意到镜头，露出一个甜美的小笑容，微微举起饮料，并自然地用日语说道：「今日は自分の時間。」然后她转身继续走路。\n\n在整个视频中保持相同的面容、发型、服装、身体比例和身份。"
    }
  }
}
