{
  "id": "2083915958524031087",
  "title": "[Global Setting] Base Environment & Texture: A city rooftop garden at golden…",
  "content": "[Global Setting] Base Environment & Texture: A city rooftop garden at golden hour,\nwarm orange light raking across wet pavement from earlier rain, soft haze in the\nskyline behind, string lights beginning to flicker on.\n\n[Opening beat, 0–8s]: Wide shot. A runner in a grey hoodie jogs into frame along\nthe rooftop path, breath visible in the cool evening air, camera holds static.\n\n[Mid beat, 8–22s]: Camera begins a slow tracking pan alongside the runner at hip\nheight, matching pace. Passing shots of string lights, a couple sharing a bench,\nsteam rising from a nearby vent. Light shifts from orange to a deeper blue as the\nsun dips further.\n\n[Closing beat, 22–30s]: Runner slows to a stop at the rooftop edge, camera arcs\naround to a three-quarter front view, city skyline fully lit behind them, runner\ncatches breath and looks out over the view. Hold on final frame.\n\nAudio: Footsteps on wet concrete, distant city ambience, wind, no music.",
  "language": "en",
  "thumbnail": "https://pbs.twimg.com/ext_tw_video_thumb/2083915915658158080/pu/img/QwKcnQucmlNGCel0.jpg",
  "videoUrl": "https://talented-lioness-5423.edgespark.app/api/public/media/seedance/videos/2083915958524031087.mp4",
  "sourceLink": "https://x.com/LudovicCreator/status/2083915958524031087",
  "sourcePublishedAt": "2026-08-02",
  "author": {
    "name": "LudovicCreator",
    "link": "https://x.com/LudovicCreator"
  },
  "tags": [
    "Action",
    "Chase",
    "Photoreal",
    "Realistic World"
  ],
  "translations": {
    "es": {
      "content": "---\n[Configuración global] Entorno base y textura: Un jardín en la azotea de un edificio en la hora dorada,\nluz naranja cálida rozando el pavimento mojado por la lluvia anterior, una suave neblina en el\nskyline del fondo, guirnaldas de luces empezando a encenderse.\n\n[Opening beat, 0–8s]: Plano general. Un corredor con sudadera gris entra en cuadro por\nel sendero de la azotea, con el aliento visible en el aire fresco de la tarde, la cámara se mantiene fija.\n\n[Mid beat, 8–22s]: La cámara comienza un slow tracking pan junto al corredor a la altura de la cadera,\nacompañando su ritmo. Planos de paso de las guirnaldas de luces, una pareja compartiendo un banco,\nvapor elevándose desde una rejilla cercana. La luz cambia de naranja a un azul más profundo a medida que\nel sol desciende.\n\n[Closing beat, 22–30s]: El corredor reduce la velocidad hasta detenerse en el borde de la azotea, la cámara\ndescribe un arco hasta un plano frontal de tres cuartos, el skyline de la ciudad completamente iluminado detrás,\nel corredor recupera el aliento y mira el paisaje. Mantener el último fotograma.\n\nAudio: Pasos sobre hormigón mojado, ambiente lejano de la ciudad, viento, sin música.\n---"
    },
    "fr": {
      "content": "---\n[Global Setting] Environnement de base & texture : Un jardin sur le toit d’un immeuble en ville à l’heure dorée,\nune lumière orange chaude rasant le pavé mouillé par la pluie tombée plus tôt, une légère brume dans\nla ligne d’horizon en arrière-plan, des guirlandes lumineuses qui commencent à s’allumer.\n\n[Opening beat, 0–8s] : Plan large. Un coureur en sweat à capuche gris entre dans le cadre en trottinant\nle long du chemin sur le toit, sa respiration visible dans l’air frais du soir, la caméra reste fixe.\n\n[Mid beat, 8–22s] : La caméra commence un slow tracking pan à hauteur de hanche, à côté du coureur,\nen gardant le même rythme. Plans de passage sur les guirlandes lumineuses, un couple partageant un banc,\nde la vapeur s’élevant d’une bouche d’aération à proximité. La lumière passe de l’orange à un bleu plus profond\nà mesure que le soleil descend.\n\n[Closing beat, 22–30s] : Le coureur ralentit jusqu’à s’arrêter au bord du toit, la caméra effectue une\narc autour de lui pour passer à une vue de trois-quarts face, la skyline de la ville entièrement illuminée\nderrière lui, le coureur reprend son souffle et contemple la vue. Maintenir le dernier cadre.\n\nAudio : Pas sur le béton mouillé, ambiance urbaine lointaine, vent, pas de musique.\n---"
    },
    "ja": {
      "content": "---\n[Global Setting] Base Environment & Texture: ゴールデンアワーの都市の屋上庭園。  \n先ほどの雨で濡れた舗道に温かなオレンジの光が斜めに差し込み、背後のスカイラインには柔らかな霞がかかり、ストリングライトが点き始めている。\n\n[Opening beat, 0–8s]: ワイドショット。グレーのフーディーを着たランナーが屋上の通路を走りながらフレーム内に入ってくる。冷たい夕方の空気の中で息が白く見え、カメラは静止したまま。\n\n[Mid beat, 8–22s]: カメラがランナーの横を、腰の高さでゆっくり tracking pan しながら並走し始める。ストリングライト、ベンチを共有するカップル、近くの換気口から立ちのぼる蒸気を次々に捉える。太陽がさらに沈むにつれて、光はオレンジからより深いブルーへと移り変わる。\n\n[Closing beat, 22–30s]: ランナーが屋上の端で立ち止まり、カメラは弧を描くように回り込んで三分の二正面のアングルへ。背後には完全に灯った都市のスカイラインが広がり、ランナーは息を整えて景色を見渡す。最後のフレームでホールド。\n\nAudio: 濡れたコンクリートを踏む足音、遠くの都市の環境音、風。音楽なし。\n---"
    },
    "ko": {
      "content": "---\n[Global Setting] Base Environment & Texture: 황금 시간대의 도시 옥상 정원,\n이전 비로 젖은 보도 위로 따뜻한 주황빛이 비스듬히 스며들고, 뒤편 스카이라인에는 옅은 안개가 깔려 있으며, 스트링 라이트가 하나둘 켜지기 시작한다.\n\n[Opening beat, 0–8s]: 와이드 샷. 회색 후디를 입은 러너가 옥상 산책로를 따라 프레임 안으로 조깅해 들어오고, 차가운 저녁 공기 속에서 숨결이 보이며, 카메라는 고정된 채 유지된다.\n\n[Mid beat, 8–22s]: 카메라는 러너와 같은 속도로, 엉덩이 높이에서 옆으로 천천히 tracking pan을 시작한다. 지나가는 샷들로는 스트링 라이트, 벤치를 함께 쓰는 커플, 가까운 환기구에서 피어오르는 증기가 보인다. 해가 더 낮게 기울면서 빛은 주황색에서 더 짙은 파란색으로 바뀐다.\n\n[Closing beat, 22–30s]: 러너가 옥상 가장자리에서 속도를 늦춰 멈추고, 카메라는 아크를 그리며 돌아 3/4 정면 구도로 전환한다. 뒤편에는 도시 스카이라인이 완전히 불을 밝히고 있고, 러너는 숨을 고르며 전망을 바라본다. 마지막 프레임을 홀드한다.\n\nAudio: 젖은 콘크리트 위 발걸음 소리, 멀리서 들리는 도시의 앰비언스, 바람, 음악 없음.\n---"
    },
    "pt": {
      "content": "---\n[Configuração Global] Ambiente Base e Textura: Um jardim no terraço de um prédio no golden hour,\nluz laranja quente varrendo o pavimento molhado pela chuva anterior, leve névoa no\nskyline ao fundo, luzes de corda começando a piscar.\n\n[Batida de abertura, 0–8s]: Plano geral. Um corredor de moletom cinza entra em cena correndo\nao longo do caminho no terraço, respiração visível no ar fresco da noite, câmera permanece estática.\n\n[Batida intermediária, 8–22s]: A câmera começa um slow tracking pan ao lado do corredor, na altura do quadril,\nacompanhando o ritmo. Passagens por luzes de corda, um casal compartilhando um banco,\nvapor subindo de uma saída de ar próxima. A luz muda de laranja para um azul mais profundo à medida que o\nsol se põe mais.\n\n[Batida final, 22–30s]: O corredor diminui o ritmo até parar na borda do terraço, a câmera faz um arco\naté uma visão frontal em três quartos, skyline da cidade totalmente iluminado ao fundo, o corredor\nrecupera o fôlego e olha para a vista. Segure o quadro final.\n\nÁudio: Passos no concreto molhado, ambiência distante da cidade, vento, sem música.\n---"
    },
    "zh": {
      "content": "[全局设定] 基础环境与质感：黄金时刻的城市屋顶花园，\n温暖的橙色光线掠过先前雨后湿润的路面，远处天际线笼罩在柔和薄雾中，串灯开始闪烁亮起。\n\n[开场节拍，0–8秒]：广角镜头。一名穿灰色连帽衫的跑者沿着屋顶小径跑入画面，冷凉的傍晚空气中可见呼吸，camera 保持静止。\n\n[中段节拍，8–22秒]：camera 开始以髋部高度沿着跑者进行缓慢的 tracking pan，保持相同速度。掠过串灯、一对坐在长椅上交谈的情侣、以及附近通风口升起的蒸汽。随着太阳进一步西沉，光线从橙色逐渐转为更深的蓝色。\n\n[收尾节拍，22–30秒]：跑者放慢脚步，在屋顶边缘停下，camera 绕行至三分之四正面视角，身后城市天际线灯火全亮，跑者喘息着望向远方景色。最终画面停留。\n\n音频：湿润水泥地上的脚步声、远处城市环境音、风声，无音乐。"
    }
  }
}
