{
  "id": "2090730417804783687",
  "title": "Use Seedance 2.5 in 1080p on Vmake Labs to generate sharper, cleaner product…",
  "content": "Use Seedance 2.5 in 1080p on Vmake Labs to generate sharper, cleaner product videos with better detail.",
  "language": "en",
  "thumbnail": "",
  "sourceLink": "https://x.com/choyamymuna/status/2090730417804783687",
  "sourcePublishedAt": "2026-08-21",
  "author": {
    "name": "Choya",
    "link": "https://x.com/choyamymuna"
  },
  "tags": [
    "Product Ad",
    "Tech",
    "Photoreal",
    "Realistic World",
    "Tutorial"
  ],
  "tips": "Use Seedance 2.5 in 1080p on Vmake Labs to generate sharper, cleaner product videos with better detail.",
  "translations": {
    "es": {
      "content": "Usa Seedance 2.5 en 1080p en Vmake Labs para generar videos de producto más nítidos y limpios, con mejor detalle.\n\n--- TUIT CITADO ---\nTu próximo video para redes sociales acaba de verse más nítido.\n\nSeedance 2.5 ya está disponible en 1080p en Vmake Labs.\n\nTomas de producto más limpias. Mejor detalle. Más motivos para detener el scroll.\n\nPruébalo ahora en Vmake Labs: https://t.co/OLCmNwbgbB https://t.co/Wh9G0oSqSW\n---"
    },
    "fr": {
      "content": "Utilisez Seedance 2.5 en 1080p sur Vmake Labs pour générer des vidéos produit plus nettes et plus propres, avec davantage de détails.\n\n--- TWEET CITÉ ---\nVotre prochaine vidéo social media vient de gagner en netteté.\n\nSeedance 2.5 est désormais disponible en 1080p sur Vmake Labs.\n\nDes prises de vue produit plus propres. De meilleurs détails. Une raison de plus d’arrêter le scroll.\n\nEssayez-le dès maintenant sur Vmake Labs : https://t.co/OLCmNwbgbB https://t.co/Wh9G0oSqSW\n---"
    },
    "ja": {
      "content": "Vmake LabsでSeedance 2.5を1080pで使用して、よりシャープでクリーンな、ディテールの優れた商品動画を生成しましょう。\n\n--- 引用ツイート ---\n次のソーシャル動画が、さらにシャープになりました。\n\nSeedance 2.5が、Vmake Labsで1080p対応になりました。\n\nよりクリーンな商品ショット。より良いディテール。スクロールを止める理由が、さらに増えました。\n\n今すぐVmake Labsで試してみてください: https://t.co/OLCmNwbgbB https://t.co/Wh9G0oSqSW\n---"
    },
    "ko": {
      "content": "Vmake Labs에서 Seedance 2.5를 1080p로 사용해 더 선명하고 깔끔한 제품 영상을, 더 나은 디테일로 생성해 보세요.\n\n--- 인용된 트윗 ---\n다음 소셜 영상이 한층 더 선명해졌습니다.\n\nSeedance 2.5가 이제 Vmake Labs에서 1080p로 제공됩니다.\n\n더 깔끔한 제품 샷. 더 나은 디테일. 스크롤을 멈추게 할 또 하나의 이유.\n\n지금 Vmake Labs에서 사용해 보세요: https://t.co/OLCmNwbgbB https://t.co/Wh9G0oSqSW\n---"
    },
    "pt": {
      "content": "Use o Seedance 2.5 em 1080p no Vmake Labs para gerar vídeos de produtos mais nítidos, limpos e com melhor nível de detalhe.\n\n--- TWEET CITADO ---\nSeu próximo vídeo para redes sociais ficou ainda mais nítido.\n\nO Seedance 2.5 agora está disponível em 1080p no Vmake Labs.\n\nImagens de produto mais limpas. Melhor detalhe. Mais motivos para parar o scroll.\n\nExperimente agora no Vmake Labs: https://t.co/OLCmNwbgbB https://t.co/Wh9G0oSqSW\n---"
    },
    "zh": {
      "content": "在 Vmake Labs 上使用 1080p 的 Seedance 2.5，生成更清晰、更干净、细节更出色的产品视频。\n\n--- 引用推文 ---\n你的下一条社交视频，画质更锐利了。\n\nSeedance 2.5 现已在 Vmake Labs 上支持 1080p。\n\n更干净的产品镜头。更好的细节。更有理由让人停下滑动。\n\n立即在 Vmake Labs 试用：https://t.co/OLCmNwbgbB https://t.co/Wh9G0oSqSW\n---"
    }
  }
}
