{
  "id": "2088645185261490301",
  "title": "Check your prompt pacing to make complex action sequences work without burning…",
  "content": "Check your prompt pacing to make complex action sequences work without burning through credits.",
  "language": "en",
  "thumbnail": "https://pbs.twimg.com/amplify_video_thumb/2088644783619104768/img/Uf-aOACtxdYAGD_B.jpg",
  "videoUrl": "https://talented-lioness-5423.edgespark.app/api/public/media/seedance/videos/2088645185261490301.mp4",
  "sourceLink": "https://x.com/JSFILMZ0412/status/2088645185261490301",
  "sourcePublishedAt": "2026-08-15",
  "author": {
    "name": "JSFILMZ",
    "link": "https://x.com/JSFILMZ0412"
  },
  "tags": [
    "Action",
    "Chase",
    "Photoreal",
    "Realistic World",
    "Tutorial"
  ],
  "tips": "Check your prompt pacing to make complex action sequences work without burning through credits.",
  "translations": {
    "es": {
      "content": "Revisa el ritmo de tu prompt para que las secuencias de acción complejas funcionen sin agotar los créditos.\n\n--- TUIT CITADO ---\n¡Ya están aquí los nuevos Viral Presets, impulsados por Seedance 2.5!\n\nSube una imagen, elige tu estilo y estará listo antes de que se enfríe tu café.\n\nhttps://t.co/FY4N5D5ZdY https://t.co/qRRp8WaP0Q\n\n--- CONTINUACIÓN DEL HILO ---\n[Hilo 1] tutorial completo usando @openart_ai https://t.co/XTquwNwaxp\n---"
    },
    "fr": {
      "content": "Vérifiez le rythme de votre prompt pour faire fonctionner des séquences d’action complexes sans épuiser vos crédits.\n\n--- TWEET CITÉ ---\nLes nouveaux Viral Presets, propulsés par Seedance 2.5, sont là !\n\nTéléversez une image, choisissez votre ambiance, et c’est terminé avant que votre café ne refroidisse.\n\nhttps://t.co/FY4N5D5ZdY https://t.co/qRRp8WaP0Q\n\n--- SUITE DU FIL ---\n[Thread 1] tutoriel complet avec @openart_ai https://t.co/XTquwNwaxp\n---"
    },
    "ja": {
      "content": "複雑なアクションシーケンスを、クレジットを無駄に消費せずに成立させるには、prompt のペーシングを確認しましょう。\n\n--- 引用ツイート ---\nSeedance 2.5 搭載の新しい Viral Presets が登場！\n\n画像を1枚アップロードして、好みの雰囲気を選ぶだけ。コーヒーが冷める前に完成します。\n\nhttps://t.co/FY4N5D5ZdY https://t.co/qRRp8WaP0Q\n\n--- スレッドの続き ---\n[Thread 1] @openart_ai を使った完全チュートリアル https://t.co/XTquwNwaxp\n---"
    },
    "ko": {
      "content": "복잡한 액션 시퀀스를 크레딧을 너무 빨리 소모하지 않고 구현하려면 prompt pacing을 확인하세요.\n\n--- 인용 트윗 ---\nSeedance 2.5로 구동되는 새로운 Viral Presets가 출시되었습니다! \n\n이미지 한 장을 업로드하고, 원하는 vibe를 고르면 커피가 식기도 전에 완료됩니다.\n\nhttps://t.co/FY4N5D5ZdY https://t.co/qRRp8WaP0Q\n\n--- 스레드 이어서 ---\n[Thread 1] @openart_ai를 활용한 전체 튜토리얼 https://t.co/XTquwNwaxp\n---"
    },
    "pt": {
      "content": "Verifique o ritmo do seu prompt para fazer sequências de ação complexas funcionarem sem gastar créditos rapidamente.\n\n--- TWEET CITADO ---\nNovos Viral Presets, impulsionados pelo Seedance 2.5, chegaram! \n\nEnvie uma imagem, escolha sua vibe e pronto antes que seu café esfrie.\n\nhttps://t.co/FY4N5D5ZdY https://t.co/qRRp8WaP0Q\n\n--- CONTINUAÇÃO DO THREAD ---\n[Thread 1] tutorial completo usando @openart_ai https://t.co/XTquwNwaxp\n---"
    },
    "zh": {
      "content": "检查你的 prompt 节奏，让复杂的动作序列顺利呈现，同时避免过快消耗 credits。\n\n--- 引用推文 ---\n由 Seedance 2.5 驱动的全新 Viral Presets 现已上线！\n\n上传一张图片，选好你的风格，在你的咖啡还没凉之前就能完成。\n\nhttps://t.co/FY4N5D5ZdY https://t.co/qRRp8WaP0Q\n\n--- 线程续篇 ---\n[Thread 1] 使用 @openart_ai 的完整教程 https://t.co/XTquwNwaxp\n---"
    }
  }
}
