{
  "id": "2086484812957937692",
  "title": "Use Dreamina’s multi-reference prompts to keep character/style consistency…",
  "content": "Use Dreamina’s multi-reference prompts to keep character/style consistency across Seedance 2.5 generations  \nUse Dreamina’s Smart Edit features to fine-tune and control Seedance 2.5 outputs after generation  \nEnable Dreamina’s 3-minute long-generation mode to create longer Seedance 2.5 videos for cinematic storytelling",
  "language": "en",
  "thumbnail": "https://pbs.twimg.com/amplify_video_thumb/2086484800597327872/img/kE4yVWyTnks_MByn.jpg",
  "videoUrl": "https://talented-lioness-5423.edgespark.app/api/public/media/seedance/videos/2086484812957937692.mp4",
  "sourceLink": "https://x.com/FellMentKE/status/2086484812957937692",
  "sourcePublishedAt": "2026-08-09",
  "author": {
    "name": "FELIX",
    "link": "https://x.com/FellMentKE"
  },
  "tags": [
    "Story",
    "Talk",
    "Photoreal",
    "Realistic World",
    "Tutorial"
  ],
  "tips": "Use Dreamina’s multi-reference prompts to keep character/style consistency across Seedance 2.5 generations  \nUse Dreamina’s Smart Edit features to fine-tune and control Seedance 2.5 outputs after generation  \nEnable Dreamina’s 3-minute long-generation mode to create longer Seedance 2.5 videos for cinematic storytelling",
  "translations": {
    "es": {
      "content": "Usa los prompts de múltiples referencias de Dreamina para mantener la coherencia de personaje y estilo en las generaciones de Seedance 2.5  \nUsa las funciones de Smart Edit de Dreamina para ajustar y controlar con precisión los resultados de Seedance 2.5 después de la generación  \nActiva el modo de generación prolongada de 3 minutos de Dreamina para crear videos más largos de Seedance 2.5 para una narrativa cinematográfica"
    },
    "fr": {
      "content": "Utilisez les prompts multi-références de Dreamina pour maintenir la cohérence des personnages et du style dans les générations Seedance 2.5  \nUtilisez les fonctionnalités Smart Edit de Dreamina pour affiner et contrôler les résultats de Seedance 2.5 après la génération  \nActivez le mode de génération longue de 3 minutes de Dreamina pour créer des vidéos Seedance 2.5 plus longues, adaptées à une narration cinématographique"
    },
    "ja": {
      "content": "Dreaminaのマルチリファレンスpromptを使って、Seedance 2.5の生成全体でキャラクターやスタイルの一貫性を保つ  \nDreaminaのSmart Edit機能を使って、生成後のSeedance 2.5出力を微調整し、コントロールする  \nDreaminaの3分間long-generationモードを有効にして、cinematicなストーリーテリングのためのより長いSeedance 2.5動画を作成する"
    },
    "ko": {
      "content": "Dreamina의 multi-reference prompt를 사용해 Seedance 2.5 생성 전반에서 캐릭터/스타일의 일관성을 유지하세요  \nDreamina의 Smart Edit 기능을 사용해 생성 후 Seedance 2.5 결과물을 세밀하게 조정하고 제어하세요  \nDreamina의 3-minute long-generation mode를 활성화해 cinematic storytelling에 적합한 더 긴 Seedance 2.5 비디오를 제작하세요"
    },
    "pt": {
      "content": "Use os prompts de múltiplas referências do Dreamina para manter a consistência de personagem/estilo entre gerações do Seedance 2.5  \nUse os recursos de Smart Edit do Dreamina para refinar e controlar os resultados do Seedance 2.5 após a geração  \nAtive o modo de geração longa de 3 minutos do Dreamina para criar vídeos mais longos com o Seedance 2.5 para storytelling cinematográfico"
    },
    "zh": {
      "content": "使用 Dreamina 的多参考 prompts，在 Seedance 2.5 生成中保持角色/风格一致性  \n使用 Dreamina 的 Smart Edit 功能，在生成后对 Seedance 2.5 的输出进行精细调整和控制  \n启用 Dreamina 的 3 分钟长生成模式，创建更长的 Seedance 2.5 视频，用于 cinematic 叙事"
    }
  }
}
