{
  "id": "2093356315309711867",
  "title": "Create a 30-second ULTRA-REALISTIC cinematic basketball sequence with the same…",
  "content": "Create a 30-second ULTRA-REALISTIC cinematic basketball sequence with the same player, outfit, ball, court, and environment throughout.\n\n[0–5s] Wide arena shot. Player ready at half-court, focused, polished floor reflections, dramatic overhead lighting. Slow push-in.\n\n[5–10s] Smooth side tracking. Player starts controlled dribbling and accelerates. ULTRA-REALISTIC ball bounce, hand contact, footwork, and body mechanics.\n\n[10–16s] Low-angle chase shot as the player sprints toward the basket. Natural body lean, powerful strides, fast dribbling, realistic momentum and subtle motion blur.\n\n[16–22s] Cinematic slow-motion crossover. Sharp weight shift and direction change with believable ball inertia. Defender reacts slightly late. Detailed footwork and natural movement.\n\n[22–30s] Player drives into a layup. Camera rises with the jump. Ball leaves fingertips with realistic backspin, banks off the glass, drops through the hoop, and the net sways naturally.\n\nSTYLE: ULTRA-REALISTIC, photorealistic sports cinematography, premium commercial quality, authentic physics, natural biomechanics, cinematic lighting, realistic textures, smooth camera transitions, high temporal consistency, 4K detail.\n\nNO warped anatomy, floating ball, sliding feet, unnatural motion, inconsistent player, excessive camera shake.\n\n16:9 | 30 SECONDS",
  "language": "en",
  "thumbnail": "https://pbs.twimg.com/amplify_video_thumb/2093356239178825728/img/loDIc8YG0PKpEpLE.jpg",
  "videoUrl": "https://talented-lioness-5423.edgespark.app/api/public/media/seedance/videos/2093356315309711867.mp4",
  "sourceLink": "https://x.com/Goodmanprotocol/status/2093356315309711867",
  "sourcePublishedAt": "2026-08-28",
  "author": {
    "name": "Saul Goodman",
    "link": "https://x.com/Goodmanprotocol"
  },
  "tags": [
    "Sports",
    "Basketball",
    "Photoreal",
    "Realistic World",
    "Slow-Mo"
  ],
  "translations": {
    "es": {
      "content": "Crea una secuencia de baloncesto cinematográfica ULTRA-REALISTA de 30 segundos con el mismo jugador, vestuario, balón, cancha y entorno en todo momento.\n\n[0–5s] Plano general de arena. El jugador está listo en la línea de medio campo, concentrado, con reflejos pulidos en el suelo e iluminación dramática desde arriba. Lento acercamiento de cámara.\n\n[5–10s] Seguimiento lateral suave. El jugador comienza a botar de forma controlada y acelera. Rebote del balón ULTRA-REALISTA, contacto de la mano, juego de pies y mecánica corporal.\n\n[10–16s] Plano de persecución desde ángulo bajo mientras el jugador corre hacia la canasta. Inclinación natural del cuerpo, zancadas potentes, bote rápido, momentum realista y sutil motion blur.\n\n[16–22s] Crossover cinematográfico en cámara lenta. Cambio de peso y de dirección marcados, con inercia del balón creíble. El defensor reacciona un poco tarde. Juego de pies detallado y movimiento natural.\n\n[22–30s] El jugador entra a canasta para una bandeja. La cámara asciende con el salto. El balón sale de las yemas de los dedos con backspin realista, rebota en el tablero, entra por el aro y la red se balancea de forma natural.\n\nSTYLE: ULTRA-REALISTIC, photorealistic sports cinematography, premium commercial quality, authentic physics, natural biomechanics, cinematic lighting, realistic textures, smooth camera transitions, high temporal consistency, 4K detail.\n\nNO warped anatomy, floating ball, sliding feet, unnatural motion, inconsistent player, excessive camera shake.\n\n16:9 | 30 SECONDS"
    },
    "fr": {
      "content": "Créez une séquence de basket de 30 secondes, ULTRA-RÉALISTE et cinématographique, avec le même joueur, la même tenue, le même ballon, le même terrain et le même environnement tout au long de la scène.\n\n[0–5s] Plan large de l’arène. Le joueur est prêt au milieu du terrain, concentré, avec des reflets sur le sol poli et un éclairage dramatique par le haut. Lent mouvement d’approche.\n\n[5–10s] Travelling latéral fluide. Le joueur commence un dribble contrôlé puis accélère. Rebond du ballon ULTRA-RÉALISTE, contact avec la main, jeu de jambes et mécanique corporelle.\n\n[10–16s] Plan de poursuite en contre-plongée alors que le joueur sprinte vers le panier. Inclinaison naturelle du corps, foulées puissantes, dribble rapide, momentum réaliste et léger flou de mouvement.\n\n[16–22s] Crossover cinématographique au ralenti. Transfert de poids net et changement de direction avec une inertie du ballon crédible. Le défenseur réagit légèrement en retard. Jeu de jambes détaillé et mouvement naturel.\n\n[22–30s] Le joueur attaque le panier pour un layup. La caméra s’élève avec le saut. Le ballon quitte le bout des doigts avec un backspin réaliste, rebondit sur la planche, traverse l’arceau et le filet ondule naturellement.\n\nSTYLE : ULTRA-RÉALISTE, cinématographie sportive photoréaliste, qualité commerciale premium, physique authentique, biomécanique naturelle, éclairage cinématographique, textures réalistes, transitions de caméra fluides, haute cohérence temporelle, détail 4K.\n\nPAS d’anatomie déformée, de ballon flottant, de pieds qui glissent, de mouvement غیر naturel, de joueur incohérent, ni de tremblements excessifs de la caméra.\n\n16:9 | 30 SECONDES"
    },
    "ja": {
      "content": "同じ選手、同じ服装、同じボール、同じコート、同じ環境を通して、30秒のULTRA-REALISTICなcinematicバスケットボールシーケンスを作成する。\n\n[0–5s] アリーナのワイドショット。選手はハーフコートで準備万端、集中している。磨かれた床の反射、ドラマチックな天井照明。ゆっくりとpush-in。\n\n[5–10s] 滑らかなサイドトラッキング。選手がコントロールされたドリブルを始め、加速する。ULTRA-REALISTICなボールのバウンド、手との接触、フットワーク、身体のメカニクス。\n\n[10–16s] 選手がバスケットへ向かって全力疾走するローアングルのチェイスショット。自然な上体の傾き、力強いストライド、速いドリブル、リアルな勢い、そして控えめなモーションブラー。\n\n[16–22s] cinematicなスローモーションのクロスオーバー。鋭い体重移動と方向転換、説得力のあるボールの慣性。ディフェンダーの反応はわずかに遅れる。詳細なフットワークと自然な動き。\n\n[22–30s] 選手がレイアップに持ち込む。カメラはジャンプに合わせて上昇する。ボールはリアルなバックスピンとともに指先を離れ、バックボードに当たってリングを通り抜け、ネットが自然に揺れる。\n\nSTYLE: ULTRA-REALISTIC, photorealistic sports cinematography, premium commercial quality, authentic physics, natural biomechanics, cinematic lighting, realistic textures, smooth camera transitions, high temporal consistency, 4K detail.\n\nNO warped anatomy, floating ball, sliding feet, unnatural motion, inconsistent player, excessive camera shake.\n\n16:9 | 30 SECONDS"
    },
    "ko": {
      "content": "같은 선수, 같은 의상, 같은 공, 같은 코트, 같은 환경을 전체 30초 동안 유지하는 ULTRA-REALISTIC 시네마틱 농구 시퀀스를 만들어라.\n\n[0–5s] 와이드 아레나 샷. 선수는 하프코트에서 준비 자세를 취하고 있으며, 집중한 표정, 광택 있는 바닥 반사, 드라마틱한 오버헤드 조명. 천천히 푸시 인.\n\n[5–10s] 부드러운 사이드 트래킹. 선수가 컨트롤된 드리블을 시작하고 속도를 높인다. ULTRA-REALISTIC한 공의 바운스, 손과의 접촉, 풋워크, 그리고 신체 메커니즘.\n\n[10–16s] 선수가 골대를 향해 전력 질주하는 로우 앵글 추적 샷. 자연스러운 상체 기울기, 강력한 보폭, 빠른 드리블, 현실적인 모멘텀과 미세한 모션 블러.\n\n[16–22s] 시네마틱 슬로모션 크로스오버. 설득력 있는 공의 관성과 함께 날카로운 체중 이동과 방향 전환. 수비수는 약간 늦게 반응한다. 세밀한 풋워크와 자연스러운 움직임.\n\n[22–30s] 선수가 레이업으로 돌파한다. 점프와 함께 카메라가 상승한다. 공은 현실적인 백스핀과 함께 손끝을 떠나고, 백보드에 맞고, 림을 통과하며, 네트가 자연스럽게 흔들린다.\n\nSTYLE: ULTRA-REALISTIC, photorealistic sports cinematography, premium commercial quality, authentic physics, natural biomechanics, cinematic lighting, realistic textures, smooth camera transitions, high temporal consistency, 4K detail.\n\nNO warped anatomy, floating ball, sliding feet, unnatural motion, inconsistent player, excessive camera shake.\n\n16:9 | 30 SECONDS"
    },
    "pt": {
      "content": "Crie uma sequência de basquete cinematográfica ULTRA-REALISTA de 30 segundos com o mesmo jogador, roupa, bola, quadra e ambiente durante toda a cena.\n\n[0–5s] Plano geral da arena. Jogador pronto na linha do meio da quadra, concentrado, reflexos no piso polido, iluminação dramática vinda de cima. Slow push-in.\n\n[5–10s] Travelling lateral suave. O jogador começa a driblar de forma controlada e acelera. Quique da bola ULTRA-REALISTA, contato com a mão, footwork e mecânica corporal.\n\n[10–16s] Plano de perseguição em ângulo baixo enquanto o jogador corre em direção à cesta. Inclinação natural do corpo, passadas fortes, drible rápido, momentum realista e leve motion blur.\n\n[16–22s] Crossover cinematográfico em slow motion. Mudança brusca de peso e de direção com inércia da bola crível. O defensor reage um pouco tarde. Footwork detalhado e movimento natural.\n\n[22–30s] O jogador avança para uma bandeja. A câmera sobe junto com o salto. A bola sai das pontas dos dedos com backspin realista, bate no vidro, cai pela cesta e a rede balança naturalmente.\n\nSTYLE: ULTRA-REALISTIC, photorealistic sports cinematography, premium commercial quality, authentic physics, natural biomechanics, cinematic lighting, realistic textures, smooth camera transitions, high temporal consistency, 4K detail.\n\nNO warped anatomy, floating ball, sliding feet, unnatural motion, inconsistent player, excessive camera shake.\n\n16:9 | 30 SEGUNDOS"
    },
    "zh": {
      "content": "创建一个 30 秒的 ULTRA-REALISTIC 电影感篮球序列，整个过程中保持同一名球员、同一套服装、同一个球、同一片球场和同一环境。\n\n[0–5s] 宽幅球馆镜头。球员在中场准备就绪，神情专注，地板反射清晰，顶部戏剧性灯光。缓慢推进。\n\n[5–10s] 平滑侧向跟拍。球员开始受控运球并加速。ULTRA-REALISTIC 的球弹跳、手部接触、脚步和身体力学。\n\n[10–16s] 低角度追拍镜头，球员冲向篮筐。自然的身体前倾、有力的步伐、快速运球、真实的动量和轻微运动模糊。\n\n[16–22s] 电影感慢动作 crossover。清晰的重心转移和方向变化，球的惯性可信。防守者反应稍慢。细致的脚步和自然动作。\n\n[22–30s] 球员突破上篮。镜头随着跳跃上升。球从指尖离开，带有真实的后旋，打板后落入篮筐，篮网自然摆动。\n\nSTYLE: ULTRA-REALISTIC, photorealistic sports cinematography, premium commercial quality, authentic physics, natural biomechanics, cinematic lighting, realistic textures, smooth camera transitions, high temporal consistency, 4K detail.\n\nNO warped anatomy, floating ball, sliding feet, unnatural motion, inconsistent player, excessive camera shake.\n\n16:9 | 30 SECONDS"
    }
  }
}
