{
  "id": "2086826931258065042",
  "title": "Use Seedance 2.5’s 50-reference-image lock to maintain character/scene…",
  "content": "Use Seedance 2.5’s 50-reference-image lock to maintain character/scene consistency across long generations (up to ~90 seconds).",
  "language": "en",
  "thumbnail": "",
  "sourceLink": "https://x.com/AIPandaX/status/2086826931258065042",
  "sourcePublishedAt": "2026-08-10",
  "author": {
    "name": "AI Panda",
    "link": "https://x.com/AIPandaX"
  },
  "tags": [
    "Scenery & Spectacle",
    "Worldbuilding",
    "Photoreal",
    "Realistic World",
    "Tutorial"
  ],
  "tips": "Use Seedance 2.5’s 50-reference-image lock to maintain character/scene consistency across long generations (up to ~90 seconds).",
  "translations": {
    "es": {
      "content": "Usa el bloqueo de 50 imágenes de referencia de Seedance 2.5 para mantener la coherencia de personajes/escenas en generaciones largas (hasta ~90 segundos).\n\n--- TUIT CITADO ---\nSeedance 2.5 ya está disponible en AITOPIA.\n\nObtén acceso a uno de los modelos más recientes de generación de video con IA con un 58% DE DESCUENTO por tiempo limitado.\n\nCrea videos impresionantes con Seedance 2.5 → https://t.co/YhQ5HQOW9v https://t.co/yEDTWQo1nZ\n---"
    },
    "fr": {
      "content": "Utilisez le verrouillage de 50 images de référence de Seedance 2.5 pour maintenir la cohérence des personnages et des scènes sur de longues générations (jusqu’à environ 90 secondes).\n\n--- TWEET CITÉ ---\nSeedance 2.5 est désormais disponible sur AITOPIA.\n\nAccédez à l’un des derniers modèles de génération vidéo par IA avec 58 % de réduction pendant une durée limitée.\n\nCréez des vidéos époustouflantes avec Seedance 2.5 → https://t.co/YhQ5HQOWv https://t.co/yEDTWQo1nZ\n---"
    },
    "ja": {
      "content": "Seedance 2.5の50枚の参照画像ロックを使って、長尺生成（最大約90秒）でもキャラクター／シーンの一貫性を維持できます。\n\n--- 引用ツイート ---\nSeedance 2.5 が AITOPIA で利用可能になりました。\n\n最新のAI動画生成モデルのひとつに、期間限定で58% OFFでアクセスできます。\n\nSeedance 2.5で魅力的な動画を作成 → https://t.co/YhQ5HQOW9v https://t.co/yEDTWQo1nZ\n---"
    },
    "ko": {
      "content": "Seedance 2.5의 50개 reference image lock을 사용해 긴 생성 과정(최대 약 90초)에서도 캐릭터/장면의 일관성을 유지하세요.\n\n--- 인용된 트윗 ---\nSeedance 2.5가 이제 AITOPIA에서 제공됩니다.\n\n최신 AI 비디오 생성 모델 중 하나를 기간 한정 58% 할인으로 이용해 보세요.\n\nSeedance 2.5로 멋진 영상을 만들어보세요 → https://t.co/YhQ5HQOW9v https://t.co/yEDTWQo1nZ\n---"
    },
    "pt": {
      "content": "Use o lock de 50 imagens de referência do Seedance 2.5 para manter a consistência de personagem/cena em gerações longas (até ~90 segundos).\n\n--- TWEET CITADO ---\nSeedance 2.5 já está disponível na AITOPIA.\n\nTenha acesso a um dos mais recentes modelos de geração de vídeo por IA com 58% DE DESCONTO por tempo limitado.\n\nCrie vídeos impressionantes com Seedance 2.5 → https://t.co/YhQ5HQOW9v https://t.co/yEDTWQo1nZ\n---"
    },
    "zh": {
      "content": "使用 Seedance 2.5 的 50 张参考图锁定功能，在长时长生成中保持角色/场景一致性（最长约 90 秒）。\n\n--- 引用推文 ---\nSeedance 2.5 现已在 AITOPIA 上线。\n\n限时享受 58% 折扣，获取最新的 AI 视频生成模型之一。\n\n使用 Seedance 2.5 创作惊艳视频 → https://t.co/YhQ5HQOW9v https://t.co/yEDTWQo1nZ\n---"
    }
  }
}
