{
  "id": "2076224129133596816",
  "title": "サイバーパンクなハッカーロボット",
  "content": "サイバーパンクなハッカーロボット",
  "language": "ja",
  "thumbnail": "https://pbs.twimg.com/amplify_video_thumb/2076224063962484736/img/WvxRHNJDpluKgyK9.jpg",
  "videoUrl": "https://talented-lioness-5423.edgespark.app/api/public/media/seedance/videos/2076224129133596816.mp4",
  "sourceLink": "https://x.com/_creatorzz_/status/2076224129133596816",
  "sourcePublishedAt": "2026-07-12",
  "author": {
    "name": "CREATOR'ZZ【公式】",
    "link": "https://x.com/_creatorzz_"
  },
  "tags": [
    "Story",
    "Drama",
    "3D Animation",
    "Sci-Fi"
  ],
  "translations": {
    "en": {
      "content": "Cyberpunk Hacker Robot\n\n--- QUOTED TWEET ---\nSeedance 2.5 (30s, single take) https://t.co/vVaxN2leDx\n\n--- THREAD CONTINUATION ---\n[Thread 1] For those interested in AI videos 🎁\n\n✅ AI Video 0→100 Roadmap\n✅ 100 Practical Prompts Selection\n✅ Exclusive Webinar Ticket\nare being distributed for free👇\n(https://t.co/j1zTtFcZ3Q)\n\nWe also explain the process of monetizing with AI videos 🔥"
    },
    "es": {
      "content": "サイバーパンクなハッカーロボット\n\n--- QUOTED TWEET ---\nSeedance 2.5 (30s, single take) https://t.co/vVaxN2leDx\n\n--- THREAD CONTINUATION ---\n[Thread 1] Para aquellos interesados en videos de IA🎁\n\n✅ Hoja de ruta de videos de IA de 0 a 100\n✅ Selección de 100 prompts prácticos\n✅ Entrada para un webinar exclusivo\nse están distribuyendo gratuitamente👇\n（https://t.co/j1zTtFcZ3Q）\n\nTambién se explica el proceso hasta la monetización con videos de IA🔥"
    },
    "fr": {
      "content": "サイバーパンクなハッカーロボット\n\n--- TWEET CITÉ ---\nSeedance 2.5 (30s, single take) https://t.co/vVaxN2leDx\n\n--- SUITE DU FIL ---\n[Fil 1] Pour ceux qui s'intéressent aux vidéos AI 🎁\n\n✅ Feuille de route de 0 à 100 pour les vidéos AI\n✅ Sélection de 100 prompts pratiques\n✅ Billet pour un webinaire exclusif\nsont distribués gratuitement👇\n（https://t.co/j1zTtFcZ3Q）\n\nNous expliquons également le processus pour monétiser avec des vidéos AI🔥"
    },
    "ko": {
      "content": "사이버펑크 해커 로봇\n\n--- 인용 트윗 ---\nSeedance 2.5 (30s, single take) https://t.co/vVaxN2leDx\n\n--- 스레드 계속 ---\n[스레드 1] AI 동영상에 관심 있는 분들께🎁\n\n✅ AI 동영상 0→100 로드맵\n✅ 실전 프롬프트 100선\n✅ 한정 웨비나 참가권\n을 무료로 배포하고 있습니다👇\n（https://t.co/j1zTtFcZ3Q）\n\nAI 동영상으로 수익화하는 과정도 설명하고 있습니다🔥"
    },
    "pt": {
      "content": "サイバーパンクなハッカーロボット\n\n--- QUOTED TWEET ---\nSeedance 2.5 (30s, single take) https://t.co/vVaxN2leDx\n\n--- THREAD CONTINUATION ---\n[Thread 1] Para quem tem interesse em vídeos de IA🎁\n\n✅ Roteiro de IA Vídeo 0→100\n✅ Seleção de 100 prompts práticos\n✅ Ingresso para webinar exclusivo\nestão sendo distribuídos gratuitamente👇\n（https://t.co/j1zTtFcZ3Q）\n\nTambém explicamos o processo até a monetização com vídeos de IA🔥"
    },
    "zh": {
      "content": "赛博朋克风格的黑客机器人\n\n--- 引用推文 ---\nSeedance 2.5 (30秒，单镜头) https://t.co/vVaxN2leDx\n\n--- 线程继续 ---\n[线程 1] 对AI视频感兴趣的朋友🎁\n\n✅ AI视频从0到100的路线图\n✅ 实践Prompt 100选\n✅ 限定网络研讨会参与券\n免费提供👇\n（https://t.co/j1zTtFcZ3Q）\n\n还解释了通过AI视频实现盈利的流程🔥"
    }
  }
}
