{
  "id": "2088022514962239696",
  "title": "Start with one image you already love as the reference, and let OnSolo/Seedance…",
  "content": "Start with one image you already love as the reference, and let OnSolo/Seedance write the story around that image.  \nCreate two character sheets and one environment plate first, then lock them so every subsequent shot stays on-model.  \nDrop a reference image/video into OnSolo, let the agent auto-generate the shot structure, then rearrange the beats instead of prompting frame-by-frame (direct the sequence rather than individual frames).",
  "language": "en",
  "thumbnail": "https://pbs.twimg.com/amplify_video_thumb/2088022135226707969/img/eEw1REnHKxpKGhgA.jpg",
  "videoUrl": "https://talented-lioness-5423.edgespark.app/api/public/media/seedance/videos/2088022514962239696.mp4",
  "sourceLink": "https://x.com/YaseenK7212/status/2088022514962239696",
  "sourcePublishedAt": "2026-08-13",
  "author": {
    "name": "Yaseen Khan Gul",
    "link": "https://x.com/YaseenK7212"
  },
  "tags": [
    "Story",
    "Talk",
    "Photoreal",
    "Realistic World",
    "Tutorial",
    "Creative Asset"
  ],
  "tips": "Start with one image you already love as the reference, and let OnSolo/Seedance write the story around that image.  \nCreate two character sheets and one environment plate first, then lock them so every subsequent shot stays on-model.  \nDrop a reference image/video into OnSolo, let the agent auto-generate the shot structure, then rearrange the beats instead of prompting frame-by-frame (direct the sequence rather than individual frames).",
  "translations": {
    "es": {
      "content": "Empieza con una imagen que ya te encante como referencia, y deja que OnSolo/Seedance escriba la historia alrededor de esa imagen.  \nCrea primero dos character sheets y una environment plate, y luego bloquéalos para que cada toma posterior se mantenga on-model.  \nSuelta una imagen/video de referencia en OnSolo, deja que el agente genere automáticamente la estructura de la toma, y luego reordena los beats en lugar de hacer prompting frame por frame (dirige la secuencia en vez de los fotogramas individuales).\n\n--- CONTINUACIÓN DEL THREAD ---\n[Thread 1] El último modelo Seedance 2.5 ya está disponible en OnSolo. si quieres probarlo: https://t.co/e2CJnyFwyZ\n\nEmpieza con una imagen que ya te encante. deja que escriba la historia alrededor de ella. sinceramente, ese es todo el flujo de trabajo.\n\n#OnSolo #OnSoloAI\n\n[Thread 2] La configuración: dos character sheets y una environment plate.\n\nVAELYNOR — guardián del juramento de plata, espada larga de punta de aguja.\n\nDROWNED REVENANT — 2,5 m, hierro fusionado al hueso, caja torácica llena de hielo marino. “el mar conserva lo que reclama.”\n\nla ubicación — un cementerio de barcos atrapados en el hielo compacto.\n\nbloquea esto primero y cada toma después se mantendrá on-model.\n\n[Thread 3] La configuración real no está editada. Tú sueltas una referencia, el agente escribe la estructura de la toma y tú reordenas los beats. No estoy haciendo prompting frame por frame; estoy dirigiendo.\n\nEl último modelo Seedance 2.5 ya está disponible en OnSolo, así que esto es lo que está saliendo de él hoy. https://t.co/U8ErspN1gx"
    },
    "fr": {
      "content": "Commencez avec une image que vous aimez déjà comme référence, et laissez OnSolo/Seedance écrire l’histoire autour de cette image.  \nCréez d’abord deux character sheets et une environment plate, puis verrouillez-les pour que chaque plan suivant reste fidèle au modèle.  \nDéposez une image/vidéo de référence dans OnSolo, laissez l’agent générer automatiquement la structure des plans, puis réorganisez les beats au lieu de faire du prompting image par image (dirigez la séquence plutôt que les images individuelles).\n\n--- SUITE DU THREAD ---\n[Thread 1] Le dernier modèle Seedance 2.5 est désormais disponible sur OnSolo. si vous voulez l’essayer : https://t.co/e2CJnyFwyZ\n\nCommencez avec une image que vous aimez déjà. laissez-la écrire l’histoire autour d’elle. c’est vraiment tout le workflow.\n\n#OnSolo #OnSoloAI\n\n[Thread 2] La configuration : deux character sheets et une environment plate.\n\nVAELYNOR — gardien du serment d’argent, épée longue à pointe d’aiguille.\n\nDROWNED REVENANT — 2,5 m, fer fusionné à l’os, cage thoracique remplie de glace de mer. « la mer garde ce qu’elle revendique. »\n\nle lieu — un cimetière de navires pris dans la banquise.\n\nverrouillez ces éléments d’abord, et chaque plan ensuite restera fidèle au modèle.\n\n[Thread 3] La configuration réelle n’est pas retouchée. Vous déposez une référence, l’agent écrit la structure des plans, et vous réorganisez les beats. Je ne fais pas de prompting image par image ; je dirige.\n\nLe dernier modèle Seedance 2.5 est désormais en ligne sur OnSolo, donc voici ce qu’il produit aujourd’hui. https://t.co/U8ErspN1gx"
    },
    "ja": {
      "content": "---\nまずは、すでに気に入っている1枚の画像を参照として使い、OnSolo/Seedance にその画像を中心に物語を書かせましょう。  \n最初に2枚のキャラクターシートと1枚の環境プレートを作成し、それらをロックしておけば、その後のすべてのショットが一貫した見た目のまま保たれます。  \nOnSolo に参照画像/動画を投入すると、エージェントがショット構成を自動生成してくれるので、フレームごとにプロンプトを書くのではなく、ビートの並びを組み替えるだけで進められます（個々のフレームではなく、シーケンス全体を指示する）。\n\n--- スレッドの続き ---\n[Thread 1] 最新の Seedance 2.5 モデルが OnSolo で利用可能になりました。試してみたい方はこちら: https://t.co/e2CJnyFwyZ\n\nまずは、すでに気に入っている1枚の画像から始めましょう。その画像を中心に物語を書かせるのです。それが本当に、ワークフローのすべてです。\n\n#OnSolo #OnSoloAI\n\n[Thread 2] 構成は、2枚のキャラクターシートと1枚の環境プレート。\n\nVAELYNOR — 銀の誓約の守護者、先端の鋭いロングソード。\n\nDROWNED REVENANT — 身長2.5m、鉄が骨に融合し、胸郭は海氷で満たされている。「海は、奪ったものを手放さない。」\n\nロケーション — 流氷に閉ざされた船の墓場。\n\nこれらを最初にロックしておけば、その後のすべてのショットが on-model のまま保たれます。\n\n[Thread 3] 実際の構成は未編集のままです。参照を1つ入れると、エージェントがショット構成を書き起こし、こちらはビートを並べ替えるだけ。私はフレームごとにプロンプトしているのではなく、演出しているのです。\n\n最新の Seedance 2.5 モデルは現在 OnSolo で公開中なので、今日ここから出てくるのはこういうものです。 https://t.co/U8ErspN1gx\n---"
    },
    "ko": {
      "content": "하나의 이미지, 이미 마음에 드는 그 이미지를 레퍼런스로 시작하고, OnSolo/Seedance가 그 이미지를 중심으로 이야기를 써 내려가게 하세요.  \n먼저 캐릭터 시트 2장과 환경 플레이트 1장을 만들고, 그다음 이를 고정해 두면 이후의 모든 샷이 계속 같은 모델을 유지합니다.  \nOnSolo에 레퍼런스 이미지/비디오를 넣으면 에이전트가 샷 구조를 자동 생성하게 두고, 프레임별로 프롬프트를 넣는 대신 비트의 순서를 재배치하세요(개별 프레임이 아니라 시퀀스를 디렉팅하는 방식).\n\n--- 스레드 계속 ---\n[스레드 1] 최신 Seedance 2.5 모델이 이제 OnSolo에서 사용 가능합니다. 사용해 보고 싶다면: https://t.co/e2CJnyFwyZ\n\n이미 하나 마음에 드는 이미지를 고르세요. 그 주변으로 이야기가 스스로 쓰이게 하세요. 그게 정말 전부인 워크플로우입니다.\n\n#OnSolo #OnSoloAI\n\n[스레드 2] 구성: 캐릭터 시트 2장과 환경 플레이트 1장.\n\nVAELYNOR — 은빛 서약의 감시자, 바늘끝처럼 뾰족한 롱소드.\n\nDROWNED REVENANT — 2.5m, 철이 뼈에 융합된 존재, 갈비뼈 안은 바다 얼음으로 가득 차 있음. “바다는 자신이 차지한 것을 지킨다.”\n\n장소 — 유빙에 갇힌 난파선들의 묘지.\n\n이것들을 먼저 고정해 두면 그 이후의 모든 샷도 계속 같은 모델을 유지합니다.\n\n[스레드 3] 실제 구성은 편집되지 않은 상태입니다. 레퍼런스를 넣으면 에이전트가 샷 구조를 작성하고, 저는 비트의 순서를 재배치합니다. 프레임별로 프롬프트를 넣는 게 아니라, 저는 디렉팅하고 있습니다.\n\n최신 Seedance 2.5 모델이 이제 OnSolo에서 바로 사용 가능하므로, 오늘은 여기서 어떤 결과가 나오는지 보여드리는 것입니다. https://t.co/U8ErspN1gx"
    },
    "pt": {
      "content": "Comece com uma imagem que você já ama como referência e deixe o OnSolo/Seedance escrever a história em torno dela.  \nCrie primeiro duas character sheets e uma environment plate, e então trave-as para que cada tomada subsequente permaneça fiel ao modelo.  \nArraste uma imagem/vídeo de referência para o OnSolo, deixe o agente gerar automaticamente a estrutura das cenas e depois reorganize os beats em vez de fazer prompt quadro a quadro (dirija a sequência, não os quadros individuais).\n\n--- CONTINUAÇÃO DO THREAD ---\n[Thread 1] O modelo Seedance 2.5 mais recente já está disponível no OnSolo. se quiser testar: https://t.co/e2CJnyFwyZ\n\nComece com uma imagem que você já ama. deixe que ela escreva a história ao redor dela. sinceramente, esse é o fluxo de trabalho inteiro.\n\n#OnSolo #OnSoloAI\n\n[Thread 2] A montagem: duas character sheets e uma environment plate.\n\nVAELYNOR — guardião do juramento de prata, espada longa de ponta em agulha.\n\nDROWNED REVENANT — 2,5 m, ferro fundido ao osso, caixa torácica מלאה de gelo marinho. “o mar guarda o que reivindica.”\n\no local — um cemitério de navios presos no gelo compacto.\n\ntrave isso primeiro e cada tomada depois permanece fiel ao modelo.\n\n[Thread 3] A montagem real não é editada. Você coloca uma referência, o agente escreve a estrutura das cenas e você reorganiza os beats. Não estou fazendo prompt quadro a quadro; estou dirigindo.\n\nO modelo Seedance 2.5 mais recente já está ao vivo no OnSolo, então é isso que está saindo dele hoje. https://t.co/U8ErspN1gx"
    },
    "zh": {
      "content": "从你已经喜欢的一张图片开始，把它作为参考，让 OnSolo/Seedance 围绕这张图来编写故事。  \n先创建两张角色设定图和一张环境板，然后将它们锁定，这样后续每个镜头都能保持 on-model。  \n把一张参考图片/视频拖入 OnSolo，让 agent 自动生成镜头结构，然后重新排列节拍，而不是逐帧写 prompt（引导演绎顺序，而不是单独控制每一帧）。\n\n--- 线程续接 ---\n[Thread 1] 最新的 Seedance 2.5 模型现已在 OnSolo 上可用。如果你想试试：https://t.co/e2CJnyFwyZ\n\n从你已经喜欢的一张图片开始。让它围绕这张图来写故事。说真的，这就是全部工作流。\n\n#OnSolo #OnSoloAI\n\n[Thread 2] 这个构建：两张角色设定图和一张环境板。\n\nVAELYNOR — 银誓守卫，针尖长剑。\n\nDROWNED REVENANT — 2.5 米高，铁与骨骼熔合，胸腔里塞满海冰。“大海会保留它所索取的一切。”\n\n地点——一座被浮冰封锁的船只墓地。\n\n先锁定这些，之后每个镜头都能保持 on-model。\n\n[Thread 3] 实际的构建过程没有经过编辑。你放入一个参考，agent 会写出镜头结构，然后你重新排列节拍。我不是在逐帧写 prompt；我是在进行导演。\n\n最新的 Seedance 2.5 模型现已在 OnSolo 上线，所以这就是它今天产出的内容。https://t.co/U8ErspN1gx"
    }
  }
}
