{
  "id": "2083637120883728546",
  "title": "A 15-second continuous one-take cinematic shot of a young female street…",
  "content": "A 15-second continuous one-take cinematic shot of a young female street musician in a rainy neon-lit Tokyo alley at night. She starts playing a violin under a flickering neon sign, raindrops bouncing off the strings; then she walks toward the camera while continuing to play, passes a group of curious passersby who stop to listen, and ends by looking directly into the lens with a hopeful smile as the rain intensifies. Soft warm key light on her face, cool blue ambient neon reflections on wet pavement, realistic water physics, subtle camera gimbal tracking forward, natural ambient rain and violin audio synchronized. High detail skin and fabric, 4K cinematic look.",
  "language": "en",
  "thumbnail": "https://pbs.twimg.com/amplify_video_thumb/2083636275064512512/img/X7putrraRUXPa7-s.jpg",
  "videoUrl": "https://talented-lioness-5423.edgespark.app/api/public/media/seedance/videos/2083637120883728546.mp4",
  "sourceLink": "https://x.com/MathisYanis/status/2083637120883728546",
  "sourcePublishedAt": "2026-08-01",
  "author": {
    "name": "Filschics",
    "link": "https://x.com/MathisYanis"
  },
  "tags": [
    "Music & Dance",
    "MV",
    "Photoreal",
    "Realistic World",
    "POV"
  ],
  "translations": {
    "es": {
      "content": "Un plano cinematográfico continuo de 15 segundos, en una sola toma, de una joven música callejera en un callejón de Tokio iluminado por neones bajo la lluvia, de noche. Comienza tocando un violín bajo un letrero de neón parpadeante, con las gotas de lluvia rebotando en las cuerdas; luego camina hacia la cámara mientras sigue tocando, pasa junto a un grupo de transeúntes curiosos que se detienen a escuchar, y termina mirando directamente al lente con una sonrisa esperanzada mientras la lluvia se intensifica. Luz principal suave y cálida sobre su rostro, reflejos ambientales de neón azul frío sobre el pavimento mojado, física del agua realista, sutil seguimiento de cámara con gimbal hacia adelante, audio natural sincronizado de lluvia ambiental y violín. Piel y telas con alto nivel de detalle, aspecto cinematográfico 4K."
    },
    "fr": {
      "content": "Un plan cinématographique continu de 15 secondes en une seule prise, montrant une jeune musicienne de rue dans une ruelle de Tokyo éclairée au néon sous la pluie, la nuit. Elle commence à jouer du violon sous une enseigne au néon vacillante, les gouttes de pluie rebondissant sur les cordes ; puis elle marche vers la caméra tout en continuant à jouer, passe devant un groupe de passants curieux qui s’arrêtent pour l’écouter, et termine en regardant directement l’objectif avec un sourire plein d’espoir tandis que la pluie s’intensifie. Éclairage principal doux et chaud sur son visage, reflets néon ambiants bleu froid sur le trottoir mouillé, physique de l’eau réaliste, léger suivi de caméra au gimbal vers l’avant, sons naturels de la pluie et du violon synchronisés. Peau et tissu très détaillés, rendu cinématographique 4K."
    },
    "ja": {
      "content": "雨に濡れたネオン輝く東京の路地で、若い女性のストリートミュージシャンを捉えた15秒の連続ワンテイクのシネマティックショット。彼女はちらつくネオンサインの下でバイオリンを弾き始め、弦に雨粒が跳ねる。その後、演奏を続けながらカメラに向かって歩き、立ち止まって耳を傾ける好奇心旺盛な通行人の一団を通り過ぎ、最後は雨が強まる中、希望に満ちた笑顔でレンズをまっすぐ見つめる。彼女の顔には柔らかな暖色のキーライト、濡れた舗道には冷たい青いネオンの反射、リアルな水の物理表現、前方へ滑らかに追従する控えめなカメラジンバルのトラッキング、自然な環境音の雨とバイオリン音が同期。肌と衣服の高精細ディテール、4Kシネマティックルック。"
    },
    "ko": {
      "content": "---\n비 오는 네온사인으로 물든 도쿄의 밤 골목에서 젊은 여성 거리 음악가를 담은 15초짜리 연속 원테이크 시네마틱 샷. 그녀는 깜빡이는 네온사인 아래에서 바이올린 연주를 시작하고, 빗방울이 현에 튀어 오르며, 이어서 연주를 계속한 채 카메라를 향해 걸어온다. 호기심 어린 행인 무리가 발걸음을 멈추고 귀를 기울이는 옆을 지나, 비가 더 거세지는 가운데 희망 어린 미소를 지으며 렌즈를 सीधे 바라보며 끝난다. 얼굴에는 부드럽고 따뜻한 키 라이트가 비치고, 젖은 보도에는 차갑고 푸른 네온 반사가 번지며, 사실적인 물리 효과, 미묘한 카메라 짐벌 전진 트래킹, 자연스러운 주변 빗소리와 바이올린 오디오가 동기화된다. 피부와 의상의 디테일이 높고, 4K 시네마틱 룩."
    },
    "pt": {
      "content": "Um plano cinematográfico contínuo de 15 segundos em uma única tomada de uma jovem musicista de rua em um beco de Tóquio à noite, sob chuva e luzes de neon. Ela começa tocando violino sob uma placa de neon piscando, com gotas de chuva ricocheteando nas cordas; em seguida, caminha em direção à câmera enquanto continua tocando, passa por um grupo de transeuntes curiosos que param para ouvir e termina olhando diretamente para a lente com um sorriso esperançoso enquanto a chuva se intensifica. Luz principal suave e quente em seu rosto, reflexos ambientais frios de neon azul no pavimento molhado, física realista da água, tracking sutil da câmera com gimbal avançando, áudio natural da chuva ambiente e do violino sincronizado. Alto nível de detalhe na pele e no tecido, visual cinematográfico em 4K."
    },
    "zh": {
      "content": "一段 15 秒的连续一镜到底电影感镜头，描绘一位年轻的女性街头音乐家在夜晚雨中的东京霓虹小巷里演奏。她先在闪烁的霓虹招牌下开始拉小提琴，雨滴在琴弦上弹跳；随后她一边继续演奏一边朝镜头走来，经过一群好奇的路人，路人停下脚步倾听；最后，随着雨势加大，她带着充满希望的微笑直视镜头。她脸上有柔和温暖的主光，湿漉漉的路面上反射着冷蓝色的环境霓虹光，真实的水体物理效果，细微的 camera gimbal 向前跟拍，自然的环境雨声与小提琴音频同步。高细节的皮肤与布料，4K 电影感画面。"
    }
  }
}
