{
  "id": "2086150917750132953",
  "title": "Use Claude Code to research your product by “spying on TikTok” and generate a…",
  "content": "Use Claude Code to research your product by “spying on TikTok” and generate a UGC-style ad script based on what’s trending  \nUse Nano Banana to create the avatar and product-shot assets before generating video  \nGenerate all scenes in Seedance 2.5 as a single continuous 30-second clip (instead of separate clips)",
  "language": "en",
  "thumbnail": "https://pbs.twimg.com/amplify_video_thumb/2086150703605772288/img/wGPVLjYDALmrMygG.jpg",
  "videoUrl": "https://talented-lioness-5423.edgespark.app/api/public/media/seedance/videos/2086150917750132953.mp4",
  "sourceLink": "https://x.com/EXM7777/status/2086150917750132953",
  "sourcePublishedAt": "2026-08-08",
  "author": {
    "name": "Machina",
    "link": "https://x.com/EXM7777"
  },
  "tags": [
    "Product Ad",
    "Tech",
    "Photoreal",
    "Realistic World",
    "Tutorial"
  ],
  "tips": "Use Claude Code to research your product by “spying on TikTok” and generate a UGC-style ad script based on what’s trending  \nUse Nano Banana to create the avatar and product-shot assets before generating video  \nGenerate all scenes in Seedance 2.5 as a single continuous 30-second clip (instead of separate clips)",
  "translations": {
    "es": {
      "content": "Usa Claude Code para investigar tu producto “espiando en TikTok” y generar un guion publicitario estilo UGC basado en lo que está en tendencia  \nUsa Nano Banana para crear el avatar y los assets de producto antes de generar el video  \nGenera todas las escenas en Seedance 2.5 como un único clip continuo de 30 segundos (en lugar de clips separados)\n\n--- CONTINUACIÓN DEL HILO ---\n[Hilo 1] compartí todo el proceso de construcción en https://t.co/WluxuWUDZC\n---"
    },
    "fr": {
      "content": "Utilisez Claude Code pour faire des recherches sur votre produit en « espionnant TikTok » et générer un script publicitaire au style UGC basé sur les tendances du moment  \nUtilisez Nano Banana pour créer l’avatar et les assets de mise en scène du produit avant de générer la vidéo  \nGénérez toutes les scènes dans Seedance 2.5 sous forme d’un seul clip continu de 30 secondes (au lieu de clips séparés)\n\n--- SUITE DU FIL ---\n[Fil 1] j’ai partagé l’intégralité du build ici https://t.co/WluxuWUDZC\n---"
    },
    "ja": {
      "content": "Claude Codeを使って「TikTokを覗き見」しながら自社製品をリサーチし、トレンドに基づいたUGC風の広告スクリプトを生成する  \nNano Bananaを使って、動画生成の前にアバターと商品ショットのアセットを作成する  \nSeedance 2.5では、各シーンを別々のクリップに分けず、30秒の1本の連続したクリップとしてすべて生成する\n\n--- スレッドの続き ---\n[スレッド1] 全体の制作過程を https://t.co/WluxuWUDZC で共有しました\n---"
    },
    "ko": {
      "content": "Claude Code를 사용해 “TikTok을 염탐”하듯 제품을 리서치하고, 지금 유행하는 트렌드를 바탕으로 UGC 스타일의 광고 스크립트를 생성하세요  \nNano Banana를 사용해 아바타와 제품 샷 에셋을 만든 뒤 비디오를 생성하세요  \nSeedance 2.5에서 모든 장면을 개별 클립이 아니라 하나의 연속된 30초 클립으로 생성하세요\n\n--- 스레드 계속 ---\n[스레드 1] 전체 빌드 과정을 https://t.co/WluxuWUDZC 에 공유했습니다\n---"
    },
    "pt": {
      "content": "Use o Claude Code para pesquisar seu produto “espionando o TikTok” e gerar um roteiro de anúncio em estilo UGC com base no que está em alta  \nUse o Nano Banana para criar o avatar e os assets de product shot antes de gerar o vídeo  \nGere todas as cenas no Seedance 2.5 como um único clipe contínuo de 30 segundos (em vez de clipes separados)\n\n--- CONTINUAÇÃO DO THREAD ---\n[Thread 1] compartilhei a construção completa em https://t.co/WluxuWUDZC\n---"
    },
    "zh": {
      "content": "使用 Claude Code 通过“监测 TikTok”来研究你的产品，并根据当前流行趋势生成一份 UGC 风格的广告脚本  \n在生成视频之前，使用 Nano Banana 创建头像和产品镜头素材  \n在 Seedance 2.5 中将所有场景生成为一个连续的 30 秒长镜头，而不是分别生成多个片段\n\n--- 线程续篇 ---\n[Thread 1] 我已在 https://t.co/WluxuWUDZC 中分享了完整的制作过程\n---"
    }
  }
}
